id,course_code,course_name,course_description,course_rationale
1,BIOL 1046,College Biology I,"College Biology I is presented as an introductory general course at the post-secondary level and will prepare students for further study. This course covers scientific methodology, plant and animal biology, biochemistry, cytology and genetics. The modes of instruction vary between lecture, discussion, experiments and discovery. ","The purpose of this course, in conjunction with Biology 1047, is to provide students with the academic biology skills required or recommended for entrance into college and other post-secondary programs with academic biology pre-requisites such as Dental Assisting, Medical Laboratory  Technology,  Pharmacy  Technology,  Water Resources and Nursing."
2,BIOL 1047,College Biology II,"College Biology II is a continuation of Biology I and will prepare students for further study. This course covers evolution, and human anatomy and physiology with an option to include a research project in an area of the students interest. The modes of instruction vary between lecture, discussion, experiments and discovery. ","The purpose of this course is to provide students with the academic biology skills required or recommended for entrance into college and other post-secondary programs with academic biology pre-requisites such as Dental Assisting,  Medical Laboratory  Technology,  Pharmacy  Technology,  Water Resources and Nursing."
3,CHEM 1046,College Chemistry I,"Chemistry I and Chemistry II are presented as introductory general courses at the post-secondary level, and will prepare students for further study. These courses start with definitions of matter, and fundamentals of chemistry such as the atom and elements, and proceed through to qualitative and quantitative problem solving. The modes of instruction vary between lecture and discovery with plenty of time given to allowing the student to carry out calculations, online interactive research, tutoria","The purpose of this course is to provide students with the academic chemistry skills required for entrance into college or university programs with academic chemistry pre-requisites such as  Water Resources  Technology, Nursing, Dental Assisting and Pharmacy  Technology."
4,CHEM 1047,College Chemistry II,"Chemistry I and Chemistry II are presented as introductory general courses at the post-secondary level, and will prepare students for further study. These courses start with definitions of matter, and fundamentals of chemistry such as the atom and elements, and proceed through to qualitative and quantitative problem solving. The modes of instruction vary between lecture and discovery with plenty of time given to allowing the student to carry out calculations, online interactive research, tutoria","The purpose of this course is to provide students with the academic chemistry skills required for entrance into college or university programs with academic chemistry pre-requisites such as  Water Resources  Technology, Nursing, Dental Assisting and Pharmacy  Technology. "
5,MATH 1048,College Health Mathematics I,"College Health Mathematics I and II offers theoretical and applied skills, with emphasis on applied problem-solving process and strategies. Concepts will be taught with a focus on preparing students for further study in college Health Programs. (Students considering University programs must consult with university admission requirements where applicable). ","The purpose of College Health Mathematics I and II is to provide students with the mathematical skills required for entrance into college or some university programs with academic mathematics pre-requisites, such as Medical Laboratory  Technician,  Pharmacy  Technician, Practical Nursing, and other allied health programs (the student must consult with university requirements). "
6,MATH 1049,College Health Mathematics II,"College Health Mathematics I and II offers theoretical and applied skills, with emphasis on applied problem-solving process and strategies. Concepts will be taught with a focus on preparing students for further study in college Health Programs. (Students considering University programs must consult with university admission requirements where applicable). ","The purpose of College Health Mathematics I and II is to provide students with the mathematical skills required for entrance into college or some university programs with academic mathematics pre-requisites, such as Medical Laboratory  Technician,  Pharmacy  Technician, Practical Nursing, and other allied health programs (the student must consult with university requirements). "
7,MATH 1046,College Mathematics I,"This course offers theoretical and applied mathematical skills, with reference to problem-solving process and strategies. Mathematical concepts will be taught with a focus on preparing students for further technical or scientific study.",This purpose of this course is to provide students with the academic mathematical skills required for entrance into college or university programs with academic mathematics pre-requisites.
8,MATH 1047,College Mathematics II,"This course offers theoretical and applied mathematical skills, with reference to problem-solving process and strategies. Mathematical concepts will be taught with a focus on preparing students for further technical or scientific study. ","This purpose of this course is to provide students with the academic mathematical skills required for entrance into college or university programs with academic mathematics pre-requisites. "
9,PHYS 1046,College Physics I,"By utilizing an intensive problem-solving approach in the study of physics principles, students will develop the ability to analyze and interpret the relationships of the physical world around them. The student will use the basic principles of physics and mathematics to develop quantitative solutions to both practical and abstract problems. The skills and knowledge gained through this approach will serve as an excellent basis for further study in technology-related college programs. ","The purpose of this course is to provide students with the academic physics skills required for entrance into college or university programs with academic physics pre-requisites such as Computer Electronics  Technician, Construction Administration  Technology, Heating,  Ventilation, Refrigeration & Air Conditioning and Industrial Instrumentation. "
10,PHYS 1047,College Physics II,"By utilizing an intensive problem-solving approach in the study of physics principles, the student will develop the ability to analyze and interpret the relationships of the physical world around them. The student will use the basic principles of physics and mathematics to develop quantitative solutions to both abstract and practical problems that may be encountered in a work environment. The skills and knowledge gained through this problem-solving approach will serve as an excellent basis for f","The purpose of this course is to provide students with the academic physics skills required for entrance into college or university programs with academic physics pre-requisites such as Architectural Engineering  Technician, Electrical Engineering  Technology,  Electronic Engineering  Technology,  Mechanical Engineering  Technology, Power Engineering Technology,  and Civil Engineering  Technology. "
11,MATH 1043,Math Foundations,"Foundations in Math offers basic math strategies and applied skills. Concepts will be taught with a focus on preparing students for academic math courses. ","The purpose of Foundations in Math is to provide students with the mathematical skills required for academic mathematics courses. "
12,MATH 1546,Pre-Calculus Math I,"Pre-Calculus Math is designed to provide learners with the mathematical understandings and critical-thinking skills identified for entry into post-secondary programs requiring the study of theoretical calculus; these traditionally include most undergraduate science and engineering programs.  Topics in this first level include trigonometric equations and identities, sequences and series, and algebraic functions. ","Completion of this course will provide the student with a math credit and the skills they need to pursue careers that require the use of theoretical calculus. "
13,MATH 1547,Pre-Calculus Math II,"This Pre-Calculus course is the second of two courses designed to provide you with the mathematical understandings and critical-thinking skills identified for entry into post-secondary programs that require the study of theoretical calculus; these traditionally include most undergraduate science and engineering programs. ",Completion of this course will provide the student with a math credit and the skills they need for further studies in programs that require the use of theoretical calculus.
14,COMM 1000,Essential Communication Skills,"This introductory level Communication course exposes you to the subtleties of interpersonal communication including non-verbal communication, listening skills, social media management and written communication. This course provides you with an overview of the communication skills required by college programs, business and industry, including reading comprehension and development.  You will learn to apply these communication skills to be successful in your future studies and/or selected workplace","The purpose of this course is to equip students with the communications skills required for any College graduate to be successful in the workplace. Students are introduced to written, oral, and interpersonal communications skills and concepts. "
15,COMM 1001,Workplace Development,"This course provides you with the opportunity to further develop writing skills acquired in Communications 1000 – Essential Communication Skills. The course also encourages exploration of job search techniques, and is designed to assist you in the development of the skills and confidence required to deliver individual oral presentations. ","The purpose of this course is to provide students with knowledge of the verbal communication process, opportunities for students to explore presentation strategies and practice verbal skills required for effective transfer of information . Students further develop writing skills and are introduced to other essential communications topics including job search, human relations, and customer service."
